"Available on Mobile Only","Dostępne tylko na aplikacji mobilnej"
"If enabled, this coupon can be applied only from mobile app requests.","Jeśli włączone, kupon może być zastosowany tylko z aplikacji mobilnej."
"Mobile Coupons","Kupony mobilne"
"Coupon with code ""%1"" does not exist.","Kupon o kodzie ""%1"" nie istnieje."
"Could not mark coupon ""%1"" as mobile-only.","Nie można oznaczyć kuponu ""%1"" jako mobilny."
"Could not remove mobile-only flag from coupon ""%1"".","Nie można usunąć flagi mobilnej z kuponu ""%1""."
"This coupon can be applied only from the mobile application.","Ten kupon może być zastosowany tylko z aplikacji mobilnej."

